[
  {
    "id": "1914:route-de-1",
    "formation": "1914:army-de-1",
    "waypoints": [
      [6.25, 50.88, "1914-08-10T12:00:00Z"],
      [6.2, 50.85, "1914-08-13T12:00:00Z"],
      [6.2, 50.85, "1914-08-14T12:00:00Z"],
      [6.2, 50.85, "1914-08-15T12:00:00Z"],
      [6.2, 50.85, "1914-08-16T12:00:00Z"],
      [6.15, 50.84, "1914-08-17T12:00:00Z"],
      [5.7, 50.78, "1914-08-18T12:00:00Z"],
      [5.3, 50.8, "1914-08-19T12:00:00Z"],
      [4.7, 50.86, "1914-08-20T12:00:00Z"],
      [4.35, 50.82, "1914-08-21T12:00:00Z"],
      [4.05, 50.6, "1914-08-22T12:00:00Z"],
      [3.95, 50.45, "1914-08-23T12:00:00Z"],
      [3.8, 50.32, "1914-08-24T12:00:00Z"],
      [3.55, 50.22, "1914-08-25T12:00:00Z"],
      [3.45, 50.1, "1914-08-26T12:00:00Z"],
      [3.15, 49.98, "1914-08-27T12:00:00Z"],
      [2.95, 49.88, "1914-08-28T12:00:00Z"],
      [2.8, 49.75, "1914-08-29T12:00:00Z"],
      [2.75, 49.62, "1914-08-30T12:00:00Z"],
      [2.9, 49.5, "1914-08-31T12:00:00Z"],
      [3.0, 49.35, "1914-09-01T12:00:00Z"],
      [2.9, 49.2, "1914-09-02T12:00:00Z"],
      [3.15, 49.03, "1914-09-03T12:00:00Z"],
      [3.2, 48.92, "1914-09-04T12:00:00Z"],
      [3.15, 48.88, "1914-09-05T12:00:00Z"],
      [3.05, 48.95, "1914-09-06T12:00:00Z"],
      [2.98, 49.03, "1914-09-07T12:00:00Z"],
      [2.95, 49.08, "1914-09-08T12:00:00Z"],
      [2.98, 49.15, "1914-09-09T12:00:00Z"],
      [3.05, 49.3, "1914-09-10T12:00:00Z"],
      [3.15, 49.4, "1914-09-11T12:00:00Z"],
      [3.25, 49.45, "1914-09-12T12:00:00Z"],
      [3.3, 49.47, "1914-09-13T12:00:00Z"],
      [3.32, 49.48, "1914-09-18T12:00:00Z"],
      [3.3, 49.52, "1914-10-01T12:00:00Z"],
      [3.28, 49.53, "1914-11-01T12:00:00Z"],
      [3.28, 49.53, "1914-11-24T12:00:00Z"]
    ],
    "confidence": "medium",
    "derivation": "Approximate centre of the army (the mass of its corps, not its headquarters) at noon each day, read off the day-by-day sketch maps in Herwig and the Reichsarchiv volume; ±10–15 km.",
    "sources": [
      {
        "source": "source:herwig-2009"
      },
      {
        "source": "source:reichsarchiv-weltkrieg-1",
        "pages": "69, 214–222, 347, 417–430, 506, 517–532",
        "note": "Bd. 1 carries this path only as far as 27 August, which is where the volume stops. p. 69 prints the deployment area the Aufmarschanweisungen gave the 1st Army — \"westlich der Rheinstrecke Duisburg–Hitdorf im Raume um Crefeld–Erkelenz–Jülich–Bergheim\" — which is where the path begins. pp. 214–222 are the advance of 18–20 August: the 20th \"verlief für die 1. und 2. Armee ohne besondere Ereignisse als reiner Marschtag\", its objectives \"in der allgemeinen Linie Brüssel–Droogenbosch–Waterloo\", the II. Corps at Vilvorde, the IV. entering Brussels \"von 3 nachmittags ab mit klingendem Spiel\", the III. at Droogenbosch and the IX. at Waterloo, and the reserve corps only up to Diest and Tirlemont — which is why the path’s point for the 20th sits east of the objective line and not on it. p. 221 gives the short march ordered for the 21st, to the line Castre–Hal–Braine-le-Château. Skizze 3 (p. 347) and Skizze 7 (p. 506) are the day-by-day sketches the derivation names: the positions of the 1st, 2nd and 3rd Armies on the mornings of 21 and 25 August. pp. 417–430 are Mons on 23–24 August, corps by corps, and pp. 517–532 the pursuit of the English through Le Cateau to 27 August."
      },
      {
        "source": "source:edmonds-1925",
        "note": "No pages: this volume’s narrative begins on 19 September 1914 and covers Antwerp and Flanders, so it is not a source for this path. Nothing on it before 19 September is in the volume at all, and the October–November tail of it lies on the Aisne, outside the volume’s front."
      },
      {
        "source": "source:strachan-2001"
      }
    ],
    "notes": "The IX Reserve Corps joined from Schleswig at the end of August; the III Reserve Corps stayed before Antwerp. 30–31 Aug: the turn south-east inside Paris; 6–9 Sep: the swing back north to the Ourcq; 9 Sep: the retreat to the Aisne. Extended past 16 September only far enough to say where the army was while the front settled; the epilogue is a chapter, not a daily reconstruction (sand-1l0.12)."
  },
  {
    "id": "1914:route-de-2",
    "formation": "1914:army-de-2",
    "waypoints": [
      [5.9, 50.66, "1914-08-05T12:00:00Z"],
      [5.95, 50.64, "1914-08-10T12:00:00Z"],
      [6.1, 50.6, "1914-08-13T12:00:00Z"],
      [6.1, 50.6, "1914-08-14T12:00:00Z"],
      [6.1, 50.6, "1914-08-15T12:00:00Z"],
      [5.85, 50.62, "1914-08-16T12:00:00Z"],
      [5.6, 50.62, "1914-08-17T12:00:00Z"],
      [5.4, 50.58, "1914-08-18T12:00:00Z"],
      [5.1, 50.62, "1914-08-19T12:00:00Z"],
      [4.8, 50.58, "1914-08-20T12:00:00Z"],
      [4.6, 50.47, "1914-08-21T12:00:00Z"],
      [4.45, 50.4, "1914-08-22T12:00:00Z"],
      [4.4, 50.32, "1914-08-23T12:00:00Z"],
      [4.25, 50.22, "1914-08-24T12:00:00Z"],
      [4.1, 50.15, "1914-08-25T12:00:00Z"],
      [3.95, 50.08, "1914-08-26T12:00:00Z"],
      [3.8, 50.02, "1914-08-27T12:00:00Z"],
      [3.68, 49.95, "1914-08-28T12:00:00Z"],
      [3.6, 49.88, "1914-08-29T12:00:00Z"],
      [3.55, 49.78, "1914-08-30T12:00:00Z"],
      [3.55, 49.65, "1914-08-31T12:00:00Z"],
      [3.62, 49.55, "1914-09-01T12:00:00Z"],
      [3.72, 49.42, "1914-09-02T12:00:00Z"],
      [3.75, 49.28, "1914-09-03T12:00:00Z"],
      [3.78, 49.1, "1914-09-04T12:00:00Z"],
      [3.65, 48.95, "1914-09-05T12:00:00Z"],
      [3.6, 48.85, "1914-09-06T12:00:00Z"],
      [3.58, 48.84, "1914-09-07T12:00:00Z"],
      [3.55, 48.87, "1914-09-08T12:00:00Z"],
      [3.5, 49.0, "1914-09-09T12:00:00Z"],
      [3.6, 49.2, "1914-09-10T12:00:00Z"],
      [3.75, 49.32, "1914-09-11T12:00:00Z"],
      [3.85, 49.4, "1914-09-12T12:00:00Z"],
      [3.9, 49.42, "1914-09-13T12:00:00Z"],
      [3.92, 49.44, "1914-09-18T12:00:00Z"],
      [3.95, 49.45, "1914-10-01T12:00:00Z"],
      [3.95, 49.45, "1914-11-24T12:00:00Z"]
    ],
    "confidence": "medium",
    "derivation": "Approximate centre of the army (the mass of its corps, not its headquarters) at noon each day, read off the day-by-day sketch maps in Herwig and the Reichsarchiv volume; ±10–15 km.",
    "sources": [
      {
        "source": "source:herwig-2009"
      },
      {
        "source": "source:reichsarchiv-weltkrieg-1",
        "pages": "69, 214–222, 347, 348–370, 386–406, 506, 507–509",
        "note": "Bd. 1 carries this path only as far as 27 August. p. 69: the 2nd Army’s deployment area \"im Raume um Düren–Aachen–Eupen–Malmedy–Blankenheim\". p. 219: on 20 August the three leading corps reached the line Mont-St. Jean–La Gatte west of Gembloux and the Guard Corps carried its flank march to Gembloux. pp. 348–370 are the crossing of the Sambre on 21–22 August and pp. 386–406 the fighting of 23–24 August, corps by corps. Skizze 3 (p. 347) and Skizze 7 (p. 506) give the army’s position on the mornings of 21 and 25 August. pp. 508–509 print where the pursuit stood on the evening of the 25th — the VII. Corps at Solre-le-Château, the X. Reserve at Clairfayts, the X. at Eppe-Sauvage, the Guard at Rance — and the objectives for the 26th: Le Cateau, Aulnoye, Marbaix, Boulogne, Féron."
      },
      {
        "source": "source:edmonds-1925",
        "note": "No pages: this volume’s narrative begins on 19 September 1914 and covers Antwerp and Flanders, so it is not a source for this path. Nothing on it before 19 September is in the volume at all, and the October–November tail of it lies on the Aisne, outside the volume’s front."
      },
      {
        "source": "source:strachan-2001"
      }
    ],
    "notes": "5–16 Aug: Emmich's Army of the Meuse (X Corps and others of this army) before Liège; The Guard Reserve Corps left for East Prussia on 25–26 Aug; the VII Reserve Corps stayed at Maubeuge until 7 Sep. Extended past 16 September only far enough to say where the army was while the front settled; the epilogue is a chapter, not a daily reconstruction (sand-1l0.12)."
  },
  {
    "id": "1914:route-de-3",
    "formation": "1914:army-de-3",
    "waypoints": [
      [6.3, 50.25, "1914-08-13T12:00:00Z"],
      [6.3, 50.25, "1914-08-14T12:00:00Z"],
      [6.3, 50.25, "1914-08-15T12:00:00Z"],
      [6.3, 50.25, "1914-08-16T12:00:00Z"],
      [6.25, 50.28, "1914-08-17T12:00:00Z"],
      [6.0, 50.35, "1914-08-18T12:00:00Z"],
      [5.7, 50.3, "1914-08-19T12:00:00Z"],
      [5.4, 50.25, "1914-08-20T12:00:00Z"],
      [5.15, 50.28, "1914-08-21T12:00:00Z"],
      [5.0, 50.27, "1914-08-22T12:00:00Z"],
      [4.91, 50.26, "1914-08-23T12:00:00Z"],
      [4.8, 50.15, "1914-08-24T12:00:00Z"],
      [4.7, 50.0, "1914-08-25T12:00:00Z"],
      [4.55, 49.9, "1914-08-26T12:00:00Z"],
      [4.45, 49.75, "1914-08-27T12:00:00Z"],
      [4.4, 49.62, "1914-08-28T12:00:00Z"],
      [4.37, 49.52, "1914-08-29T12:00:00Z"],
      [4.45, 49.45, "1914-08-30T12:00:00Z"],
      [4.4, 49.35, "1914-08-31T12:00:00Z"],
      [4.35, 49.25, "1914-09-01T12:00:00Z"],
      [4.35, 49.15, "1914-09-02T12:00:00Z"],
      [4.3, 49.05, "1914-09-03T12:00:00Z"],
      [4.2, 48.98, "1914-09-04T12:00:00Z"],
      [4.05, 48.85, "1914-09-05T12:00:00Z"],
      [3.98, 48.78, "1914-09-06T12:00:00Z"],
      [3.98, 48.76, "1914-09-07T12:00:00Z"],
      [3.95, 48.74, "1914-09-08T12:00:00Z"],
      [4.0, 48.85, "1914-09-09T12:00:00Z"],
      [4.2, 49.0, "1914-09-10T12:00:00Z"],
      [4.3, 49.15, "1914-09-11T12:00:00Z"],
      [4.15, 49.28, "1914-09-12T12:00:00Z"],
      [4.05, 49.3, "1914-09-13T12:00:00Z"],
      [4.1, 49.3, "1914-09-18T12:00:00Z"],
      [4.2, 49.28, "1914-10-01T12:00:00Z"],
      [4.2, 49.28, "1914-11-24T12:00:00Z"]
    ],
    "confidence": "medium",
    "derivation": "Approximate centre of the army (the mass of its corps, not its headquarters) at noon each day, read off the day-by-day sketch maps in Herwig and the Reichsarchiv volume; ±10–15 km.",
    "sources": [
      {
        "source": "source:herwig-2009"
      },
      {
        "source": "source:reichsarchiv-weltkrieg-1",